data,operazione,descrizione_documento,importo,note
2020-05-05,entrata,seconda rata donazione di cui al protocollo di intesa del 18/03/2020,8464339.10,
2020-05-05,uscita,trasferimento seconda rata donazione di cui al protocollo di intesa al commissario straordinario,8464339.10,
2020-05-14,entrata,donazione finalizzata - fondazione irccs policlinico san matteo di pavia. progetto plasma iperimmune.,1016459.00,
2020-05-22,entrata,donazione finalizzata Ð fondazione irccs policlinico san matteo di pavia. progetto plasma iperimmune.,13385.00,
2020-06-04,entrata,prima rata donazione di cui al protocollo di intesa del 18/03/2020,79982260.90,
2020-06-04,uscita,trasferimento prima rata donazione di cui al protocollo di intesa al commissario straordinario,79982260.90,
2020-09-06,uscita,bonifico prima rata prot. n. 33743 Ð fondazione irccs policlinico san matteo di pavia. progetto plasma iperimmune.,514922.00,
2021-03-26,uscita,saldo alla chiusura del conto corrente con versamento nel conto di tesoreria intestato alla pcm per la successiva riassegnazione nel capitolo di spesa del cr 13 del bilancio autonomo della presidenza del consiglio dei ministri,520078.00,
,entrata,interessi alla chiusura c.c.,5156.00,chiusura conto